=~=~=~=~=~=~=~=~=~=~=~= PuTTY log 2015.11.28 14:05:33 =~=~=~=~=~=~=~=~=~=~=~=
19:08:09.948175 ARP, Request who-has 10.168.1.11 tell 10.168.1.1, length 46
19:08:09.948198 ARP, Reply 10.168.1.11 is-at fe:16:3e:00:78:91, length 28
19:08:10.047297 ARP, Request who-has 172.16.1.11 tell 172.16.1.1, length 46
19:08:10.148673 ARP, Request who-has 10.168.1.12 tell 10.168.1.1, length 46
19:08:10.249579 ARP, Request who-has 10.168.1.13 tell 10.168.1.1, length 46


# Test Case 6
19:09:56.886190 IP 192.168.1.11.38015 > 10.168.1.2.80: Flags [S], seq 776368683, win 14600, options [mss 1460,sackOK,TS val 250113647 ecr 0,nop,wscale 6], length 0
19:09:56.886252 IP 10.168.1.2.80 > 192.168.1.11.38015: Flags [S.], seq 1988271180, ack 776368684, win 14480, options [mss 1460,sackOK,TS val 250117293 ecr 250113647,nop,wscale 6], length 0
19:09:56.928569 ARP, Request who-has 192.168.1.11 tell 172.16.1.1, length 46
19:09:57.021406 IP 192.168.1.11.38015 > 10.168.1.2.80: Flags [.], ack 1, win 229, options [nop,nop,TS val 250113778 ecr 250117293], length 0
19:09:57.022378 IP 192.168.1.11.38015 > 10.168.1.2.80: Flags [P.], seq 1:184, ack 1, win 229, options [nop,nop,TS val 250113778 ecr 250117293], length 183
19:09:57.022410 IP 10.168.1.2.80 > 192.168.1.11.38015: Flags [.], ack 184, win 243, options [nop,nop,TS val 250117429 ecr 250113778], length 0
19:09:57.022635 IP 10.168.1.2.80 > 192.168.1.11.38015: Flags [P.], seq 1:289, ack 184, win 243, options [nop,nop,TS val 250117429 ecr 250113778], length 288
19:09:57.022678 IP 10.168.1.2.80 > 192.168.1.11.38015: Flags [F.], seq 289, ack 184, win 243, options [nop,nop,TS val 250117429 ecr 250113778], length 0
19:09:57.120880 IP 192.168.1.11.38015 > 10.168.1.2.80: Flags [.], ack 289, win 245, options [nop,nop,TS val 250113876 ecr 250117429], length 0
19:09:57.120888 IP 192.168.1.11.38015 > 10.168.1.2.80: Flags [F.], seq 184, ack 290, win 245, options [nop,nop,TS val 250113876 ecr 250117429], length 0
19:09:57.120894 IP 10.168.1.2.80 > 192.168.1.11.38015: Flags [.], ack 185, win 243, options [nop,nop,TS val 250117528 ecr 250113876], length 0
