=~=~=~=~=~=~=~=~=~=~=~= PuTTY log 2015.11.28 13:27:09 =~=~=~=~=~=~=~=~=~=~=~=
/usr/sbin/tcpdump -nn -i eth1
tcpdump: verbose output suppressed, use -v or -vv for full protocol decode
listening on eth1, link-type EN10MB (Ethernet), capture size 65535 bytes
18:29:24.074544 ARP, Request who-has 10.168.1.11 tell 10.168.1.1, length 46
18:29:24.074564 ARP, Reply 10.168.1.11 is-at fe:16:3e:00:78:91, length 28
18:29:24.174747 ARP, Request who-has 172.16.1.11 tell 172.16.1.1, length 46
18:31:09.544936 ARP, Request who-has 192.168.1.11 tell 172.16.1.1, length 46
18:31:09.676141 IP 172.16.1.11.38912 > 10.168.1.3.80: Flags [S], seq 3333055138, win 14600, options [mss 1460,sackOK,TS val 247796801 ecr 0,nop,wscale 6], length 0
18:31:09.676178 IP 10.168.1.3.80 > 172.16.1.11.38912: Flags [S.], seq 1158253667, ack 3333055139, win 14480, options [mss 1460,sackOK,TS val 247790083 ecr 247796801,nop,wscale 6], length 0
18:31:09.676193 IP 172.16.1.11.38913 > 10.168.1.3.80: Flags [S], seq 3853328914, win 14600, options [mss 1460,sackOK,TS val 247796801 ecr 0,nop,wscale 6], length 0
18:31:09.676198 IP 10.168.1.3.80 > 172.16.1.11.38913: Flags [S.], seq 873181849, ack 3853328915, win 14480, options [mss 1460,sackOK,TS val 247790083 ecr 247796801,nop,wscale 6], length 0
18:31:09.755687 IP 172.16.1.11.38913 > 10.168.1.3.80: Flags [.], ack 1, win 229, options [nop,nop,TS val 247796886 ecr 247790083], length 0
18:31:09.769627 IP 172.16.1.11.38913 > 10.168.1.3.80: Flags [P.], seq 1:248, ack 1, win 229, options [nop,nop,TS val 247796886 ecr 247790083], length 247
18:31:09.769654 IP 10.168.1.3.80 > 172.16.1.11.38913: Flags [.], ack 248, win 243, options [nop,nop,TS val 247790176 ecr 247796886], length 0
18:31:09.769670 IP 172.16.1.11.38912 > 10.168.1.3.80: Flags [.], ack 1, win 229, options [nop,nop,TS val 247796894 ecr 247790083], length 0
18:31:09.769927 IP 10.168.1.3.80 > 172.16.1.11.38913: Flags [P.], seq 1:491, ack 248, win 243, options [nop,nop,TS val 247790177 ecr 247796886], length 490
18:31:09.769953 IP 10.168.1.3.80 > 172.16.1.11.38913: Flags [F.], seq 491, ack 248, win 243, options [nop,nop,TS val 247790177 ecr 247796886], length 0
18:31:09.770219 IP 172.16.1.11.38912 > 10.168.1.3.80: Flags [P.], seq 1:372, ack 1, win 229, options [nop,nop,TS val 247796894 ecr 247790083], length 371
18:31:09.770231 IP 10.168.1.3.80 > 172.16.1.11.38912: Flags [.], ack 372, win 243, options [nop,nop,TS val 247790177 ecr 247796894], length 0
18:31:09.770393 IP 10.168.1.3.80 > 172.16.1.11.38912: Flags [P.], seq 1:289, ack 372, win 243, options [nop,nop,TS val 247790177 ecr 247796894], length 288
18:31:09.770422 IP 10.168.1.3.80 > 172.16.1.11.38912: Flags [F.], seq 289, ack 372, win 243, options [nop,nop,TS val 247790177 ecr 247796894], length 0
18:31:09.879792 IP 172.16.1.11.38913 > 10.168.1.3.80: Flags [.], ack 491, win 245, options [nop,nop,TS val 247797011 ecr 247790177], length 0
18:31:09.928679 IP 172.16.1.11.38912 > 10.168.1.3.80: Flags [.], ack 289, win 245, options [nop,nop,TS val 247797011 ecr 247790177], length 0
18:31:09.928732 IP 172.16.1.11.38913 > 10.168.1.3.80: Flags [F.], seq 248, ack 492, win 245, options [nop,nop,TS val 247797011 ecr 247790177], length 0
18:31:09.928740 IP 10.168.1.3.80 > 172.16.1.11.38913: Flags [.], ack 249, win 243, options [nop,nop,TS val 247790336 ecr 247797011], length 0
18:31:09.928815 IP 172.16.1.11.38912 > 10.168.1.3.80: Flags [F.], seq 372, ack 290, win 245, options [nop,nop,TS val 247797011 ecr 247790177], length 0
18:31:09.928821 IP 10.168.1.3.80 > 172.16.1.11.38912: Flags [.], ack 373, win 243, options [nop,nop,TS val 247790336 ecr 247797011], length 0




18:36:09.882621 IP 172.16.1.11.38944 > 10.168.1.3.80: Flags [S], seq 1267117412, win 14600, options [mss 1460,sackOK,TS val 248097011 ecr 0,nop,wscale 6], length 0
18:36:09.882654 IP 10.168.1.3.80 > 172.16.1.11.38944: Flags [S.], seq 916195361, ack 1267117413, win 14480, options [mss 1460,sackOK,TS val 248090289 ecr 248097011,nop,wscale 6], length 0
18:36:09.965235 IP 172.16.1.11.38944 > 10.168.1.3.80: Flags [.], ack 1, win 229, options [nop,nop,TS val 248097092 ecr 248090289], length 0
18:36:09.965242 IP 172.16.1.11.38944 > 10.168.1.3.80: Flags [P.], seq 1:248, ack 1, win 229, options [nop,nop,TS val 248097092 ecr 248090289], length 247
18:36:09.965274 IP 10.168.1.3.80 > 172.16.1.11.38944: Flags [.], ack 248, win 243, options [nop,nop,TS val 248090372 ecr 248097092], length 0
18:36:09.965544 IP 10.168.1.3.80 > 172.16.1.11.38944: Flags [P.], seq 1:491, ack 248, win 243, options [nop,nop,TS val 248090372 ecr 248097092], length 490
18:36:09.965568 IP 10.168.1.3.80 > 172.16.1.11.38944: Flags [F.], seq 491, ack 248, win 243, options [nop,nop,TS val 248090372 ecr 248097092], length 0
18:36:10.049309 IP 172.16.1.11.38944 > 10.168.1.3.80: Flags [.], ack 491, win 245, options [nop,nop,TS val 248097180 ecr 248090372], length 0
18:36:10.052523 IP 172.16.1.11.38944 > 10.168.1.3.80: Flags [F.], seq 248, ack 492, win 245, options [nop,nop,TS val 248097180 ecr 248090372], length 0
18:36:10.052534 IP 10.168.1.3.80 > 172.16.1.11.38944: Flags [.], ack 249, win 243, options [nop,nop,TS val 248090459 ecr 248097180], length 0
